text,intent;
Can you look into why my most recent top-up is showing as pending? I thought it was supposed to be instantaneous.,pending_top_up;
I just made a top-up but it shows as pending! I use your service all the time and have never had a problem before. Why does it keep showing up as pending?,pending_top_up;
How long does my top up pending last?,pending_top_up;
I topped up last night but dont have any funds\, why not?,pending_top_up;
How long should it take for my top-up to finish? Ive been waiting a while.,pending_top_up;
Is there a reason my top-up has not gone through?,pending_top_up;
Problem with my top up going through,pending_top_up;
How do I know if my top-up went through?,pending_top_up;
Can you please sort out your top up? I need this to go through asap because I really need the money. Its already been pending for an hour.,pending_top_up;
Can you tell me why my pop-up is still pending?,pending_top_up;
new customer and filling gas for the first time today\, not working\,,pending_top_up;
Whats taking my top-up so long?,pending_top_up;
What is wrong with my top-up?,pending_top_up;
When will my top up process?,pending_top_up;
Can you explain to me why a top-up would still be pending?,pending_top_up;
How long will it take for my top up to work? Its still pending,pending_top_up;
Isnt my top-up supposed to mean its complete?,pending_top_up;
What is the reason that my top-up is still pending?,pending_top_up;
When will my top up go through?,pending_top_up;
Please sort your top up! My top up has been pending for an hour already. Can you please make it go through as soon as possible. I really need the money.,pending_top_up;
My top-up has not posted.,pending_top_up;
I made a top up yesterday but its still pending.,pending_top_up;
Hello\, Im a brand new customer and tried topping up for the first time today. It has been pending for half an hour and doesnt seem to be working. Please resolve this.,pending_top_up;
I have a new card and I cant add money to it.  I tried about 30 minutes ago and it is still pending.  What do I do?,pending_top_up;
Im not certain my top-up went through yet.,pending_top_up;
Ive been waiting for over an hour for a top up to go through.  How long is this supposed to take?  I really need this money.,pending_top_up;
Where to check top ups pending?,pending_top_up;
Cancel a transaction,cancel_transfer;
Am I able to cancel a transfer I just made,cancel_transfer;
I needed to make a payment on my account\, but I typed in the incorrect number.  The app wont allow me to cancel this transaction.  I need it cancelled ASAP!!,cancel_transfer;
I made a mistake this morning when I did a transfer. How do I reverse it?,cancel_transfer;
Can I cancel a transaction?,cancel_transfer;
Hi\, I sent a payment to the wrong account number - can you cancel it as soon as possible?,cancel_transfer;
How do I revert a transaction?,cancel_transfer;
I just realized I made the wrong transaction yesterday. Would  you please make it correct?I need it by tomorrow Please.,cancel_transfer;
How do i cancel a charge?,cancel_transfer;
I didnt want to make a transaction\, I want to revert it,cancel_transfer;
Is there a way to undo a transaction?,cancel_transfer;
I accidentally made a payment from the wrong account yesterday. Its my rent payment\, and its very large\, so the account I paid from wont be able to cover the amount. Its really important that the payment be made from the right account?,cancel_transfer;
I would like help to revert a transaction I did this morning,cancel_transfer;
Please help revert my transaction from this morning.,cancel_transfer;
Is there any way to cancel my transfer,cancel_transfer;
I messed up a transfer and need to reverse it.,cancel_transfer;
Please cancel my most recent transfer\, it was a mistake. This is an emergency. It needs to be canceled before it goes through.,cancel_transfer;
I made a mistake and performed a transaction on the wrong account!,cancel_transfer;
I want to revert a transaction I did this morning,cancel_transfer;
I need to change a transfer.,cancel_transfer;
How do I cancel a transaction?,cancel_transfer;
I need to cancel a transaction please!,cancel_transfer;
I want to revert a transaction I did,cancel_transfer;
Could I please cancel my transfer\, I paid it into the wrong account. I need to pay it into the right account by tomorrow.,cancel_transfer;
I need a transfer cancelled.,cancel_transfer;
I did a transaction this morning and now I want to cancel it.,cancel_transfer;
A transfer has to be cancelled.,cancel_transfer;
Is it possible to cancel a transaction?,cancel_transfer;
I messed up and made a transaction using the wrong account.,cancel_transfer;
One of my transactions needs to be canceled.,cancel_transfer;
I need to stop a transaction that I made.,cancel_transfer;
I need to cancel a transfer I made.,cancel_transfer;
My transfer was wrong\, are you able to stop it before it goes through please?,cancel_transfer;
I used the wrong account.,cancel_transfer;
Ive made a horrible mistake!  I transferred money to the wrong account by accident!  I entered one of the digits wrong.  I need this cancelled immediately please.,cancel_transfer;
What are the steps I need to take to cancel a transaction?,cancel_transfer;
I would like to cancel a transfer...is this possible?,cancel_transfer;
I want to cancel the transaction I made earlier,cancel_transfer;
I submitted a transaction but it was for the incorrect account.,cancel_transfer;
I stupidly initiated a rent payment from the wrong account yesterday. It cant be paid from that account\, but it really needs to get paid on time. Am I able to move the payment to the right account?,cancel_transfer;
Can you help me to quickly cancel a transaction I accidentally did to the wrong account?,cancel_transfer;
I dont think the transaction has gone through\, so can I cancel a transfer?,cancel_transfer;
I wanna revert a transaction i did this morning.,cancel_transfer;
I did a transaction to a wrong account!,cancel_transfer;
Please help me cancel a transaction.,cancel_transfer;
I entered a typo when I was transferring money and now Ive sent it to an incorrect account.  This is so bad!  I need it cancelled now.,cancel_transfer;
How fast can you fix an error in payment?  I made a payment in the wrong account yesterday and it needs to be adjusted by tomorrow for my rent.,cancel_transfer;
Please cancel my last transaction.,cancel_transfer;
How to cancel a transaction,cancel_transfer;
I need to cancel a transfer,cancel_transfer;
Help me cancel a transfer.,cancel_transfer;
who do I talk to\, to cancel a transfer?,cancel_transfer;
Help! I need to cancel a transaction.,cancel_transfer;
I made a mistake and need to cancel a transfer.,cancel_transfer;
If I make a mistake can I cancel the transaction?,cancel_transfer;
I need to cancel a transaction.,cancel_transfer;
I dont need to transfer anymore and I want to cancel it.,cancel_transfer;
How do I cancel a transfer?,cancel_transfer;
I made a mistake on the last transfer I made\, who must I speak with to cancel?,cancel_transfer;
Who do I call to cancel a transfer?,cancel_transfer;
It is extremely important that I cancel the transfer I made yesterday and put the money into a different account.  Is this possible?,cancel_transfer;
I made a transaction to the wrong account!,cancel_transfer;
Is there any way to cancel a recent transfer?  I did not mean to make it and need to make sure it does not go through.,cancel_transfer;
Is there a way to revert a transaction?,cancel_transfer;
I have a transaction and would like to know if I its cancelable?,cancel_transfer;
I accidentally made a payment to a wrong account. What should I do?,cancel_transfer;
How can I cancel my transfer?,cancel_transfer;
I just realized I made the wrong transaction  yesterday. Would  you please make it correct?I need it by tomorrow.,cancel_transfer;
Am I able to stop a transfer?,cancel_transfer;
I made a transaction\, but I made it to an account I didnt mean to make it to.,cancel_transfer;
stop the transaction,cancel_transfer;
I need to reverse a transaction,cancel_transfer;
I just realised I made the wrong payment yesterday. Can you please change it to the right account? Its my rent payment and really really needs to be in the right account by tomorrow,cancel_transfer;
Ive just made a money transfer to the wrong account\, I need to stop the money from being moved as it may be going to someone I dont know.  Please can you help?,cancel_transfer;
Please help!  The app wont let me cancel a money transfer.  I accidently sent money to an account that wasnt mine.  I need this cancelled immediately.,cancel_transfer;
Help me cancel a transaction.,cancel_transfer;
I already made a transfer and want to cancel it\, how do I do that?,cancel_transfer;
Hi \, I just came to know I made the wrong transaction  yesterday. Would  you please make it correct?I need it by tomorrow.,cancel_transfer;
I sent a payment to the wrong account number - can that transaction be reversed? I am worried about accidentally giving my money away.,cancel_transfer;
I want to reverse a transaction I did this morning,cancel_transfer;
I need you to stop the transfer I just started as soon as possible\, I just realized its not correct!,cancel_transfer;
I would like to cancel my previous transaction,cancel_transfer;
I need urgent help. I realize I sent my payment to the wrong account number. I made a typo. Please cancel the transfer now. There isnt an option from the app.,cancel_transfer;
I made a mistake and did a transaction to a wrong account\, can I cancel?,cancel_transfer;
Hi\, I made a transfer yesterday that I need to reverse.  I need to put the money in a different account.,cancel_transfer;
I need urgent help. I realize I sent my payment to the wrong account number. I made a typo. Please cancel the transfer immediately. I cannot do anything from the app.,cancel_transfer;
I want to cancel a transaction.,cancel_transfer;
I made a rent payment from the wrong account yesterday. It absolutely has to go through tomorrow\, so can you please reroute the payment to the right account?,cancel_transfer;
I no longer want to transfer funds\, can we cancel that transaction?,cancel_transfer;
I made a mistake when sending a payment\, sending it to the wrong account number (with a typo) - can you please cancel the transaction?,cancel_transfer;
I need to cancel my recent transfer as soon as possible. I made an error there. Please help before it goes through.,cancel_transfer;
I am trying to revert a transcation I did this morning,cancel_transfer;
A payment I made is for a wrong amount can you help me correct the mistake.,cancel_transfer;
I inadvertently completed a transaction on a wrong account.,cancel_transfer;
I used the wrong account number!,cancel_transfer;
How can I cancel a transfer I made,cancel_transfer;
I made a mistake of transferring\, can I cancel my previous transfer?,cancel_transfer;
I made a mistake when making my last transfer\, please cancel before it goes thru.,cancel_transfer;
Can I stop a transaction?,cancel_transfer;
I wish to cancel a transfer,cancel_transfer;
I want to take back my transaction,cancel_transfer;
Is it possible for a transaction to be cancelled?,cancel_transfer;
Hey i need help urgently. I just realised I sent my payment to the wrong account number\, there is a typo! Please cancel it immediately\, I cant do it anymore from the app,cancel_transfer;
is it possible to cancel transactions?,cancel_transfer;
Help! I made a transfer in error and need to cancel it before its complete!,cancel_transfer;
I made a terrible mistake when typing in my account number.  I accidently sent money to the wrong account.  I noticed the app wont allow me to void the transaction.  Can someone help me with this immediately?,cancel_transfer;
Is it possible to cancel my transfer?,cancel_transfer;
How do I fix a transaction to the wrong account?,cancel_transfer;
I goofed up and used the wrong account.  Please help.,cancel_transfer;
I want to cancel a transfer I just made.,cancel_transfer;
Cancel Transaction,cancel_transfer;
Could you refund my transaction\, I paid it into the wrong account. I need to be able to pay it into the right account by tomorrow.,cancel_transfer;
My transaction is on the wrong account.,cancel_transfer;
I paid my rent into the wrong account\, could you please pay it into the right account\, it needs to be done by tomorrow.,cancel_transfer;
How do I go about cancelling a transaction?,cancel_transfer;
I have arranged a transfer\, but no longer need to send it. How do I stop the transfer?,cancel_transfer;
I would like to cancel a transfer,cancel_transfer;
Please help me\, there is a transaction in the incorrect account.,cancel_transfer;
How can I revert a transaction from this morning?,cancel_transfer;
How do I cancel a recent transfer?,cancel_transfer;
Please can you block the transaction I just sent from my account? It was a payment but I accidently typed in the wrong details and think it might have gone to the wrong place.,cancel_transfer;
I made a transaction this morning but I need to revert it now.,cancel_transfer;
I made the incorrect payment for my rent yesterday and this needs to be fixed by no later than tomorrow. How can you help?,cancel_transfer;
I recently made a transfer but I need to cancel it as soon as possible.  Please let me know when this happens.,cancel_transfer;
I made a transfer into my account and now I need to cancel it,cancel_transfer;
Cancel my transfer\, please.,cancel_transfer;
I need to cancel a transaction immediately.,cancel_transfer;
Please help me!  A payment I made had an error on the account number and I cant cancel on my side.  Can you cancel it?,cancel_transfer;
I need to cancel my recent transfer quickly since I made a mistake. Please help before it goes through.,cancel_transfer;
Can I cancel a transfer I made,cancel_transfer;
Where do I go to cancel a transaction?,cancel_transfer;
How can I cancel a transaction to a wrong account?,cancel_transfer;
Theres been a transaction to the wrong account.,cancel_transfer;
Please cancel the transfer I just made.  I put in the wrong account number and cant seem to stop it on the app.,cancel_transfer;
I want to revert this mornings transaction.,cancel_transfer;
I didnt mean to do the transfer\, is there any way to cancel it?,cancel_transfer;
I need immediate assistance in canceling a transfer which was a mistake. Please help me quickly so this does not go through.,cancel_transfer;
Cancelling a transaction,cancel_transfer;
The wrong account was used during a transaction.,cancel_transfer;
I just initiated a transfer but Id like to cancel it.,cancel_transfer;
My morning transaction needs to be canceled.,cancel_transfer;
My transaction from earlier needs to be reversed.,cancel_transfer;
I recently made a transfer that I would like to cancel,cancel_transfer;
Yesterday\, I made an incorrect payment to the wrong account for my rent payment. I need this addressed as soon as possible and the funds transferred to the correct account by no later than tomorrow.,cancel_transfer;
What do I need to do to cancel a transaction?,cancel_transfer;
How can I cancel this transaction?,cancel_transfer;
Help please!  My rent payment is coming out tomorrow and I made a payment mistake yesterday! Can you put in in the correct account?,cancel_transfer;
I need help right now. I realize I sent my payment to the wrong account number after making a typo. Please cancel the transfer now since I cant do it from the app.,cancel_transfer;
I need help as fast as possible! I made a mistake on my most recent transfer; can you please stop it before it goes through?,cancel_transfer
I want to cancel a transaction from this morning.,cancel_transfer;
A transfer has been made in my account that I need to cancel.  This was a mistake on my part and I hope we can get this resolved quickly.,cancel_transfer;
I need to cancel my recent transfer. I made a mistake. Please help quickly before the transfer goes through.,cancel_transfer;
Im really upset because I made a typo during a transfer and now Ive sent money to the wrong account.  I cant fix this with the app.  Please help me immediately!,cancel_transfer;
There was a transaction this morning that Id like to reverse.,cancel_transfer;
What do I have to do to cancel a transfer?,cancel_transfer;
I wanted to transfer money to another account\, but now I dont have to so Id like to cancel said transfer. How can I do that?,cancel_transfer;
please cancel the transaction,cancel_transfer;
What is the max amount of top-ups?,top_up_limits;
Are top-ups unlimited?,top_up_limits;
Can I increase my top-up maximum?,top_up_limits;
Can I top-up any amount?,top_up_limits;
Whats the limit to how much I can top up?,top_up_limits;
Would I be able to top up as much as I can?,top_up_limits;
Do I have a limit to the number of top-ups per day?,top_up_limits;
need to know if there is a maximum i can top up,top_up_limits;
How many top-ups am I allowed to do?,top_up_limits;
How much is ok for me to top up with?,top_up_limits;
What is the maximum I can top up?,top_up_limits;
what is the most money i can top up?,top_up_limits;
Are there any top-up limits?,top_up_limits;
Is there a limit to the top-ups someone can do?,top_up_limits;
What is the greatest number of times that I can top-up?,top_up_limits;
Tell me if there is a limit to top-up.,top_up_limits;
Is there a top-up limit that I have to stay under during a given period of time?,top_up_limits;
How much am I allowed to top-up?,top_up_limits;
Is there a limit on how much I can top up?,top_up_limits;
Is there a limit to how much I can top-up?,top_up_limits;
Is there a limit for the amount I can top up?,top_up_limits;
what is the limit for top-ups?,top_up_limits;
How much can I top up in a day?,top_up_limits;
Do top-ups have limits?,top_up_limits;
Is there a limit to how much I can top up?,top_up_limits;
Please tell me the limit to topping-up.,top_up_limits;
Do top-up limits exist?,top_up_limits;
I would like to know how much I can top-up.,top_up_limits;
Whats the limit on my top up,top_up_limits;
Are there any top-up limits that I must follow?,top_up_limits;
Can I top-up any amount I wish on any given day?,top_up_limits;
Is topping up unlimited?,top_up_limits;
What is the highest amount of top ups Im allowed?,top_up_limits;
is there a limit for top up?,top_up_limits;
Can I set my own top-up limit?,top_up_limits;
What are the rules for a top-up?,top_up_limits;
How often can I top up?,top_up_limits;
What is the highest amount I can top-up?,top_up_limits;
What is the most that I can top-up to a card?,top_up_limits;
What limits are the to top-ups?,top_up_limits;
How many times can I make a top-up?,top_up_limits;
Whats the max I can top up,top_up_limits;
What is the maximum top up?,top_up_limits;
What is the top-up limit for my card?,top_up_limits;
Tell me if there is a top-up limit.,top_up_limits;
What number of times can I top-up?,top_up_limits;
is there a limit to top up,top_up_limits;
Whats the maximum amount I can top up my card with please?,top_up_limits;
How can I information on my limit for top-ups?,top_up_limits;
It seems I need to get information on limits for top-ups.,top_up_limits;
Are there any top-up limits involved?,top_up_limits;
What is my top-up limit?,top_up_limits;
Are there limits with top-up?,top_up_limits;
What is the max top-up?,top_up_limits;
What is your maximum top up limit per day?,top_up_limits;
I need to add a serious amount of cash to my card\, how do I do that?,top_up_limits;
Tell me about the limit for top ups.,top_up_limits;
Is there a limit to my top-up?,top_up_limits;
Is there a topping up limit?,top_up_limits;
Can I create my own top-up limit?,top_up_limits;
Can I top up?,top_up_limits;
How much could I top up?,top_up_limits;
How many top-ups can be approved?,top_up_limits;
What is the top-up limit?,top_up_limits;
Do you limit my top-offs?,top_up_limits;
Is the top-up amount unlimited?,top_up_limits;
How many top-ups can I use?,top_up_limits;
Is there a maximum for top-ups?,top_up_limits;
Will you set a limit to my top-up?,top_up_limits;
Is there a top-up limit?,top_up_limits;
How often am I able to top-up?,top_up_limits;
Can someone please tell me how much I can top-up?,top_up_limits;
What is the maximum for top-ups?,top_up_limits;
Do you have any top-up limits?,top_up_limits;
Do top-ups have a limit?,top_up_limits;
Can I top up any amount?,top_up_limits;
Can I use as many top-ups as I want?,top_up_limits;
Do I need to use a limit on top-ups?,top_up_limits;
What amount can I top-up?,top_up_limits;
Can you tell me the limit for top ups?,top_up_limits;
I need someone to assist me with explaining how much I can top-up.,top_up_limits;
What is the most I can top-up?,top_up_limits;
Is there a limit for top ups?,top_up_limits;
What is the max I can top up?,top_up_limits;
How often can I top up my account?,top_up_limits;
Whats the amount that I can top-up?,top_up_limits;
Do you limit my top-ups?,top_up_limits;
is there a limit on top ups,top_up_limits;
What is the top-up limit on my cards?,top_up_limits;
Whats my limit for topping up?,top_up_limits;
what are limits to top up,top_up_limits;
Is there any amount in which I would get cut off from topping up?,top_up_limits;
How much is the limit for top-ups?,top_up_limits;
How much can I top up on my card?,top_up_limits;
limits on top ups,top_up_limits;
What is the daily limit on my card?,top_up_limits;
Whats the top-up limit?,top_up_limits;
Why did I only receive a partial amount of what I tried to withdraw?,wrong_amount_of_cash_received;
my atm transaction was wrong,wrong_amount_of_cash_received;
why did i only get 20.00,wrong_amount_of_cash_received;
Why is my cash request and the amount I received different?,wrong_amount_of_cash_received;
I tried to withdraw $100\, all it gave me was $20.,wrong_amount_of_cash_received;
The ATM didnt give me enough money.,wrong_amount_of_cash_received;
When I went to withdraw cash today the ATM gave me the wrong amount of cash. The app is showing a larger amount.,wrong_amount_of_cash_received;
I didnt get the all the cash i wanted from the atm,wrong_amount_of_cash_received;
I received $20 but I entered $100,wrong_amount_of_cash_received;
Hi\, I used an ATM today to take money out of my account\, but the amount it gave me is not the amount I requested. What should I do?,wrong_amount_of_cash_received;
Did a WD earlier at an ATM.  The amount showing in the App is more than I got though.,wrong_amount_of_cash_received;
I didnt get the correct amount of money from the ATM machine,wrong_amount_of_cash_received;
Some cash was missing at ATM.,wrong_amount_of_cash_received;
I didnt get all the cash I asked for,wrong_amount_of_cash_received;
I tried to withdraw $100 but only got $20. What happened?,wrong_amount_of_cash_received;
how come when i asked for 100 it only gave me 20.00 in the app,wrong_amount_of_cash_received;
Asked for $100 but only got $20. Why would this happen?,wrong_amount_of_cash_received;
I wanted to withdraw $100 from the ATM but I only got $20,wrong_amount_of_cash_received;
I got less money than I asked for.,wrong_amount_of_cash_received;
Hi\, Please help me to request cash back. As i have been withdrawn money from ATM\, but i got wrong amount. in Application its showing the amount i have been charged through.,wrong_amount_of_cash_received;
The cash I wanted wasnt there.,wrong_amount_of_cash_received;
I requested a higher amount for my cash withdrawal,wrong_amount_of_cash_received;
The amount of cash I received did not match the amount I requested,wrong_amount_of_cash_received;
The ATM didnt give me the full requested amount,wrong_amount_of_cash_received;
The amount of cash I received was not the full amount,wrong_amount_of_cash_received;
How can I request cash back? The ATM just gave me the wrong amount that Ive been charged though...,wrong_amount_of_cash_received;
I was only given $20 after trying to withdraw $100,wrong_amount_of_cash_received;
I received less cash than the amount I specified in the ATM.,wrong_amount_of_cash_received;
I went tot the ATM earlier today and didnt realize this till now but I did not get all the money I requested.  I believe my account was charged for 100 but I only got 80.  Is there any way we can solve this problem?,wrong_amount_of_cash_received;
I got less cash than what I specified at the ATM.,wrong_amount_of_cash_received;
Why did I not get the amount of money I requested?,wrong_amount_of_cash_received;
Im at the ATM right now and it only allowed me to withdraw 10 pounds instead of my requested 30. Whats going on? How can I fix this?,wrong_amount_of_cash_received;
I got $20 when I shouldve gotten $100,wrong_amount_of_cash_received;
How can I request cash back? The ATM gave me the wrong amount that Ive been charged though...,wrong_amount_of_cash_received;
I didnt receive the amount of cash I requested for the ATM.,wrong_amount_of_cash_received;
my cash balance less than what I thought,wrong_amount_of_cash_received;
It didnt give me my cash,wrong_amount_of_cash_received;
It kept my cash,wrong_amount_of_cash_received;
I only got $20 of the $100 that I attempted to withdraw.,wrong_amount_of_cash_received;
Hi\, I draw out some money from the ATM today. The ATM has given me wrong amount and the application is displaying more amount than i withdraw.,wrong_amount_of_cash_received;
I tried taking out 30 pounds from the ATM just now and it only gave me 10. Why would it do that? I need the 30 pounds now!,wrong_amount_of_cash_received;
HELP! I tried to get cash and it gave me some\, but not the right amount!,wrong_amount_of_cash_received;
