text,intent;
Why is my card not working anymore?,card_not_working;
I cant use my card for anything,card_not_working;
Whats wrong with my card? The clerk at the grocery store said it was declined.,card_not_working;
What should I do if I cant use my card?,card_not_working;
Can I use app to reset PIN attempts?,card_not_working;
Please help.  The card wont work.,card_not_working;
I wasnt able to use my card today when I went out for lunch. Wondering why that is?,card_not_working;
My card doesnt seem to work.,card_not_working;
Currently I cant get my card to work.,card_not_working;
WHAT IS THE MAIN REASON OF THIS PROBLEM,card_not_working;
How do I get my card to work?,card_not_working;
What can I do to make my physical card work?,card_not_working;
Can you tell me why I cant make any transactions?,card_not_working;
There is something wrong with my card. Tried to use it a few times today in different places and it just didnt work. The transactions I tried to make were really small so not sure whats going on,card_not_working;
Can you tell me whats going on with my card it seems to be not working?,card_not_working;
How do I check security settings using the app?,card_not_working;
I tried using my card at multiple vendors and now its not working.,card_not_working;
Can you help me with my card\, I think its broke.,card_not_working;
The card is non-functional.,card_not_working;
I havent been able to complete any transactions on my card today. Do you know whats wrong?,card_not_working;
Today I used my card at a restaurant and it was declined. Why?,card_not_working;
Did you deactivate my card its not working anymore,card_not_working;
Need help to get my card to work.,card_not_working;
Why isnt my card working anymore?,card_not_working;
Why wont my card work anymore?,card_not_working;
Why wont the machine accept my card anymore?,card_not_working;
When I was in a restaurant today my card was declined and payment wouldnt go through and I need help. Can you fix this?,card_not_working;
What to do if my physical card is not working?,card_not_working;
My card stopped working after multiple transactions. Why?,card_not_working;
Why wont my card accept any transactions?,card_not_working;
I think my card is broken or something. I tried using it and it wouldnt go through\, please help.,card_not_working;
My card is broken,card_not_working;
I tried to purchase airline tickets online this morning and my card information isnt working. Is there something going on with my account?,card_not_working;
My card no longer works.,card_not_working;
I seem to be unable to make any transactions.,card_not_working;
I cant get my actual card to work,card_not_working;
My card doesnt work when I use it.,card_not_working;
What do I do if my card gets broken?,card_not_working;
I am having problems with my physical card.,card_not_working;
How can I get my card to work?,card_not_working;
I need help with understanding why my card is not working.,card_not_working;
Please help me!  My physical card isnt working right.,card_not_working;
My card stopped working. How do I check if there is a freeze on it?,card_not_working;
I dont know whats wrong with my card\, but it has not worked at multiple places today.,card_not_working;
I need clarity on why my card is not working.,card_not_working;
My card wont physically work.,card_not_working;
Whats going on? My card wont accept any transactions.,card_not_working;
My card dont work.,card_not_working;
My card wont work right now.,card_not_working;
How can it be that my Card is not functioning anymore?,card_not_working;
Whats going on with my card? Ive tried multiple times and it never goes through.,card_not_working;
HOW LONG TO TAKE THE TIME TO SOLVE,card_not_working;
What do I do if my card is not working?,card_not_working;
What should I do if my physical card isnt working?,card_not_working;
The card that I have isnt working. This is the physical card.,card_not_working;
Can I change from AUD to GBP?,exchange_via_app;
I need to exchange between different currencies\, like GBP and USD. Can I do that with your app?,exchange_via_app;
How can I change to another currency?,exchange_via_app;
Does the app allowing exchanges between USD and GBP,exchange_via_app;
What if I need to use GBP instead of USD?,exchange_via_app;
I am from X but am traveling to Y - how do I get currency for Y?,exchange_via_app;
Is it possible to change from AUD to GBP?,exchange_via_app;
Can money be exchanged from one currency to another?,exchange_via_app;
How can I change USD to GBP?,exchange_via_app;
What currencies can be exchanged in the app?,exchange_via_app;
Can i add a new currency to my account?,exchange_via_app;
How can I exchange AUD for GBP?,exchange_via_app;
Can I possibly change my currency to another?,exchange_via_app;
I would like to exchange currencies on the app. How do I do this?,exchange_via_app;
What do I do to exchange currency?,exchange_via_app;
Is it possible to exchange currencies?,exchange_via_app;
Can turn my money into another currency?,exchange_via_app;
I would like to change to a different currency.,exchange_via_app;
How can I change currency type?,exchange_via_app;
I do not need GBP\, I need AUD\, how do I convert it?,exchange_via_app;
Instead of GBP\, how do I exchange for AUD?,exchange_via_app;
Is currency exchange possible?,exchange_via_app;
Using your app\, would I be able to exchange between USD and GBP?,exchange_via_app;
Can I use this app for both USD and GBP?,exchange_via_app;
I am trying to find out how to exchange currency X with currency Y.,exchange_via_app;
Does your app allow currency exchanges between USD and GBP?,exchange_via_app;
With this app\, will I be able to exchange currency?,exchange_via_app;
How do I change my currency to another?,exchange_via_app;
How do I exchange currencies using the app?,exchange_via_app;
Does this app allow currencies to be exchanged?,exchange_via_app;
Can I exchange USD for GBP in your app?,exchange_via_app;
Is it possible to exchange currencies using the app?,exchange_via_app;
How do I exchange currencies using this app?,exchange_via_app;
I want to exchange USD and GBP with the app,exchange_via_app;
How do I change my AUD into GBP?,exchange_via_app;
How can I convert currencies?,exchange_via_app;
Can I use your app to exchange between USD and GBP,exchange_via_app;
I need to get some Euros for my holiday. Am I able to exchange some of my money?,exchange_via_app;
Can currencies be exchanged on this app?,exchange_via_app;
How do I change to a different currency?,exchange_via_app;
Is exchanging currencies a feature of the app?,exchange_via_app;
Where can I get my currencies exchanged?,exchange_via_app;
Is exchanging currencies one of your app services?,exchange_via_app;
Can I convert currency with the app?,exchange_via_app;
I might need to exchange between USD and GBP\, is this possible with your app?,exchange_via_app;
I need to exchange my GBP to AUD\, how would I do this?,exchange_via_app;
Do you support changing the currency I use?,exchange_via_app;
Can I convert money into different currencies?,exchange_via_app;
Where can i exchange between GBP and USD,exchange_via_app;
How to exchange my currency,exchange_via_app;
How do I use the app to exchange currencies?,exchange_via_app;
I no longer need AUD\, I need GBP instead\, how can I make this happen?,exchange_via_app;
I am trying to exchange AUD for GBP\, how do I do that?,exchange_via_app;
How do I exchange USD to GBP?,exchange_via_app;
Is there a way to make my money usable in another country?,exchange_via_app;
How do I exchange AUD for GBP?,exchange_via_app;
Can I use this app to exchange currencies?,exchange_via_app;
How can I exchange currencies using your app?,exchange_via_app;
How do I go about exchanging currencies with this app?,exchange_via_app;
Can I exchange from USD to GBP?,exchange_via_app;
Does your app allow currency exchange from USD to GBP?,exchange_via_app;
What currences are available for exchange?,exchange_via_app;
Is this app capable of exchanging currencies?,exchange_via_app;
Is it possible to change from USD to GBP with your App?,exchange_via_app;
If I need to make an exchange from USD to GBP\, how can I do so in the app?,exchange_via_app;
Can I use this app to exchange between dollars and pounds?,exchange_via_app;
Will this app allow me to exchange currencies?,exchange_via_app;
Is it possible to exchange USD and GBP on the app?,exchange_via_app;
I may need to exchange my USD for GBP\, can your app do that?,exchange_via_app;
How do I exchange currencies with this,exchange_via_app;
I need Australian dollars instead of UK currency.,exchange_via_app;
Im having difficulties changing AUD for GBP. How do I do this?,exchange_via_app;
Can I exchange currencies with the app?,exchange_via_app;
Will you tell me how to exchange USD for GBP in the app?,exchange_via_app;
How do you exchange currencies,exchange_via_app;
How can I exchange currencies with this app?,exchange_via_app;
How can I exchange GBP for AUD?,exchange_via_app;
Can I exchange currency for different types?,exchange_via_app;
Does this app exchange currencies?,exchange_via_app;
Is it possible to exchange currencies on the app?,exchange_via_app;
Whats the process of changing from GBP to AUD?,exchange_via_app;
How do I switch to a different currency?,exchange_via_app;
Whats the procedure with currency exchange?,exchange_via_app;
How to I switch my money for the money used in another country?,exchange_via_app;
Will it be possible to change from USD to GBP with this App?,exchange_via_app;
I would like to change currency,exchange_via_app;
How do I make a currency exchange?,exchange_via_app;
I cant figure out how to change GBP to AUD\, what do I do?,exchange_via_app;
I accidentally chose to exchange GBP\, but I need to pick AUD. How can I change it?,exchange_via_app;
How can I exchange USD and GBP in the app?,exchange_via_app;
How can I exchange currencies in the app?,exchange_via_app;
I need to exchange a currency - can I do that here?,exchange_via_app;
How can I change the currency Im exchanging from AUD to GBP?,exchange_via_app;
What do I need to do to exchange my money?,exchange_via_app;
I would like to exchange currencies\, how do I go upon it?,exchange_via_app;
What different currencies can I get?,exchange_via_app;
I would like to exchange currency  What types are there?,exchange_via_app;
how to exchange currencies,exchange_via_app;
Can I use your app to exchange USD for GBP?,exchange_via_app;
Can this convert money?,exchange_via_app;
Can you  tell me how to get AUD not GBP?,exchange_via_app;
How can I trade currencies with this app?,exchange_via_app;
Can I exchange currencies usign this app?,exchange_via_app;
Can this app be used to exchange currencies?,exchange_via_app;
need to exchange currencies,exchange_via_app;
How do I change to AUD from GBP?,exchange_via_app;
How do I start an exchange between GBP and AUD?,exchange_via_app;
Whats types of currency can I exchange?,exchange_via_app;
how can i exchange currencies,exchange_via_app;
Can I exchange USD and GBP from the app?,exchange_via_app;
What steps do I need to take to exchange currencies?,exchange_via_app;
What other currencies are available to change to?,exchange_via_app;
what currencies can i exchange between on your app?,exchange_via_app;
Can this app exchange American and English currency?,exchange_via_app;
My plans may change so I may need to change from GBP to AUD.,exchange_via_app;
Does the app allow for exchanges between currencies?,exchange_via_app;
I may no longer need GBP\, but instead I will need AUD\, how can I go about making this change?,exchange_via_app;
Can I use this app to change money?,exchange_via_app;
Has there been any activity on my card today?,lost_or_stolen_card;
I lost my wallet and all my cards were in it.,lost_or_stolen_card;
Im panicking!  I lost my card!  Help!,lost_or_stolen_card;
I need to report a stolen card,lost_or_stolen_card;
How do I replace a stolen card?,lost_or_stolen_card;
Can you provide information for freezing my card immediately?,lost_or_stolen_card;
Whats the phone number to freeze a card?,lost_or_stolen_card;
I cant find my card! Can you help?,lost_or_stolen_card;
Hi\, I am on vacation in Spain and someone stole my bag with my phone and wallet with cards and everything. Can you block it ASAP and then I want to order a new one also ASAP.,lost_or_stolen_card;
Help! I lost my card!,lost_or_stolen_card;
My card is missing.  Please help.,lost_or_stolen_card;
I think that my card has been stolen!,lost_or_stolen_card;
My card was stolen,lost_or_stolen_card;
A fee shouldnt apply to me if my card was stolen.,lost_or_stolen_card;
My card has been stolen. I reported it with the police\, but I need to report it with you as well.,lost_or_stolen_card;
Can you tell me the status of my new card?,lost_or_stolen_card;
My card has been stolen what do I do?,lost_or_stolen_card;
I cant find my card\, it is lost.,lost_or_stolen_card;
My card is lost!  Please help me!,lost_or_stolen_card;
I believe that my card has been stolen!,lost_or_stolen_card;
What should I do if I think my card was stolen?,lost_or_stolen_card;
Can you send me a new card and block my current one. Im in Spain and my wallet was stolen.,lost_or_stolen_card;
I thought I left my card at a restaurant\, but they claim not to have it and now I dont have any idea where it is. Im so worried that someone might be using it fraudulently. Is there any way to look into this?,lost_or_stolen_card;
My bag got stolen with all my cards. Can you please cancel my card and send a new one?,lost_or_stolen_card;
I think my card is stolen!,lost_or_stolen_card;
Help!  I fear that my card was stolen\,,lost_or_stolen_card;
Someone stole my card!,lost_or_stolen_card;
Are you able to guide me to my cards location?,lost_or_stolen_card;
How can I report that my card was stolen? I made a police report first.,lost_or_stolen_card;
My card is missing!  Help!,lost_or_stolen_card;
My wallet was stolen\, along with my cards. How do I put a freeze on my cards and order a new one?,lost_or_stolen_card;
Could you please freeze my card immediately?,lost_or_stolen_card;
i need help\, i lost my card,lost_or_stolen_card;
What can I do if I lost my card?,lost_or_stolen_card;
I think that the card is stolen.  What are my next steps?,lost_or_stolen_card;
What do I do if my card is stolen?,lost_or_stolen_card;
My card is stolen.  Help!,lost_or_stolen_card;
I lost track of my card,lost_or_stolen_card;
Report stolen card,lost_or_stolen_card;
Help!  My card is stolen.,lost_or_stolen_card;
My card was lost on vacation\, I dont know where it is. Can you help me take care of this immediately?,lost_or_stolen_card;
I have lost my card! What is my next step?,lost_or_stolen_card;
My card has been lost! help!,lost_or_stolen_card;
What do I do if my card has been lost or stolen?,lost_or_stolen_card;
Help Me!  I lost my card.  What should I do?,lost_or_stolen_card;
Someone stole my wallet with my card in it while vacationing in Spain. I really need my card blocked and a new one ordered.,lost_or_stolen_card;
Who can I speak with regarding a lost card?,lost_or_stolen_card;
My card has gone missing.,lost_or_stolen_card;
oh my god I lost my card! what should I do?,lost_or_stolen_card;
I cant find my card!  What should I do?,lost_or_stolen_card;
What is the first step that I should take after my card has been stolen?,lost_or_stolen_card;
I seem to have lost my card.,lost_or_stolen_card;
My card was stolen. What do I need to do?,lost_or_stolen_card;
Someone took my card without permission,lost_or_stolen_card;
I lost my card n need a new one.,lost_or_stolen_card;
My card has been lost / stolen,lost_or_stolen_card;
I misplaced my card and I dont know where the last place is where I used the card last. Can you look at my account and tell me the last place I used the card?,lost_or_stolen_card;
Please help me.  My card is missing.,lost_or_stolen_card;
I lost my card\, what do I do now?,lost_or_stolen_card;
I need to order a new card as my other one was stolen.,lost_or_stolen_card;
I think someone stole my card because I cant find it.,lost_or_stolen_card;
What are the steps I need to do if I have a stolen card?,lost_or_stolen_card;
I cant find my card.,lost_or_stolen_card;
I think my card is lost.  What do I do?,lost_or_stolen_card;
What should I do if my card is stolen?,lost_or_stolen_card;
How do I deactivate a stolen card?,lost_or_stolen_card;
I want to block my card or deactivate it or something\, its been stolen and I dont want it misused. I want this handled right away.,lost_or_stolen_card;
Someone took my card without my permission.,lost_or_stolen_card;
Need help with a stolen card.,lost_or_stolen_card;
help\, lost my card,lost_or_stolen_card;
What do I do if my card was stolen.,lost_or_stolen_card;
I think my wallet fell out on the Tube today! I realized as soon as I got to my desk. How do I cut off the card?,lost_or_stolen_card;
My card is missing.,lost_or_stolen_card;
How do I report my card as lost or stolen?,lost_or_stolen_card;
Is there any way for you to find my card?,lost_or_stolen_card;
Ive lost my card. What can I do about that?,lost_or_stolen_card;
I left my card at a restaurant and now its missing.,lost_or_stolen_card;
Can you help me retrieve my card?,lost_or_stolen_card;
I lost my card. Can you help me?,lost_or_stolen_card;
What should I do?  My card has been stolen!,lost_or_stolen_card;
My card was stolen last night.,lost_or_stolen_card;
Could you assist me in finding my lost card?,lost_or_stolen_card;
I want to open an account for my children,age_limit;
How old do you need to be to use the banks services?,age_limit;
Whats the minimum age to have an account,age_limit;
Can my children open an account?,age_limit;
How old do I need to be?,age_limit;
What are age requirements for opening an account?,age_limit;
Is there any age limit?,age_limit;
We want to start a college fund for my daughter.,age_limit;
Hold old do my kids have to be to use the service?,age_limit;
Can I start an account for my kids?,age_limit;
How old does my daughter have to be to open an account?,age_limit;
What is minimum age for an account?,age_limit;
What is needed for my daughter to open an account?,age_limit;
What about my children?,age_limit;
What is the process for setting up and account for my child?,age_limit;
Is there an age limit to open an account,age_limit;
How old do my kids have to be use this?,age_limit;
Can I make an account for my kids?,age_limit;
Id like to open an account for my kids can I do that?,age_limit;
Would it be possible to open up an account for children?,age_limit;
Do you have any age limit?,age_limit;
If I want my son to have his own account is that possible?,age_limit;
Could I open an account for children?,age_limit;
What does my daughter need to open an account?,age_limit;
Can my children get an account?,age_limit;
What is the age limit for an account?,age_limit;
What age do you have to be?,age_limit;
What is the appropriate age for my child to be able to open an account?,age_limit;
How do I open an account for my children?,age_limit;
What are the requirements to open an account for a minor?,age_limit;
are there age requirements,age_limit;
Is there an age limit for opening an account?,age_limit;
Can my 8 year old grandson open an account at the bank?,age_limit;
What is the minimum age required to open an account with your service?,age_limit;
If I want to get an account for my daughter\, can I do that?,age_limit;
How old do you have to be to open an account?,age_limit;
I have young kids. Can they use this service?,age_limit;
Do you have an age limit?,age_limit;
How old do you have to be?,age_limit;
Could my daughter open an account?,age_limit;
Can I open an account for my children?,age_limit;
What would the age limit be?,age_limit;
What are the age requirements for service?,age_limit;
I am 16 and just started working at McDonalds can I deposit my checks at your bank?,age_limit;
Is there a possibility to open an account for my sons and daughters?,age_limit;
Is there an age limit to get an account?,age_limit;
what is the age limit for opening a new account,age_limit;
Is my daughter eligible to open an account?,age_limit;
How do I set up an account for my children?,age_limit;
May I get an account for my daughter?,age_limit;
What is the minimum age limit?,age_limit;
How old must I be to open an account?,age_limit;
What is the age limit?,age_limit;
Can my children have an account?,age_limit;
Is there any way I could open an account for my daughter?,age_limit;
Can I get an account for my daughter?,age_limit;
How old do you need to be to open an account?,age_limit;
Do you offer account services for children and teens?,age_limit;
From which age can my kids use your service?,age_limit;
What is the youngest age for an account?,age_limit;
I have kids and Im curious at what age could they start to use your service.,age_limit;
At what age can I open an account?,age_limit;
Id like to open an account for my children. How can I do that?,age_limit;
Can I open up an account for my child?,age_limit;
Is there a limit for age?,age_limit;
How can I open an account for my children?,age_limit;
Do you have a children account available?,age_limit;
At what age can my children use your service?,age_limit;
I want to open an account for my child.,age_limit;
At what age can a person open an account?,age_limit;
How old do kids have to be to open an account?,age_limit;
What is your age limit?,age_limit;
How old do my kids need to be to use your service?,age_limit;
I would like to get an account for my child.,age_limit;
Would I be able to open an account for my daughter?,age_limit;
Can my teenager have an account?,age_limit;
What age do you have to be to open an account?,age_limit;
How old do my kids need to be to open an account?,age_limit;
As my kids get older are they able to get set up with their own accounts?,age_limit;
Is there an age limit to when my child can use these services?,age_limit;
How many years old do I have to be?,age_limit;
Do you have a limit for someones age?,age_limit;
Do you have any accounts for children ?,age_limit;
Can my daughter make an account?,age_limit;
I need to set up an account for my daughter\, how would I do that?,age_limit;
How old can one use your service?,age_limit;
Do you have to be 18 to make an account?,age_limit;
Would I be able to get an account for my child?,age_limit;
Can I get an account for my son?,age_limit;
DO I have to be 18 to open an account?,age_limit;
Am I allowed to get an account for my daughter?,age_limit;
My daughter needs to open account.,age_limit;
Can I open an account for my offspring?,age_limit;
Do you offer accounts for minors?,age_limit;
What are the age limits for your service?,age_limit;
How old do you need to be to have an account?,age_limit;
How old does my daughter need to be to have her own account?,age_limit;
My son has just turned 13\, is he old enough for an account?,age_limit;
Do you guys have any age restrictions?,age_limit;
Is there a minimum age for having an account?,age_limit;
How old does one need to be?,age_limit;
My daughter needs an acount.,age_limit;
What is the age requirement?,age_limit;
Is there a certain age I need to be?,age_limit;
Is my child too young to sign up?,age_limit;
Am I able to open an account for my children?,age_limit;
Can I make an account for my daughter?,age_limit;
Whats the youngest I can be to open an account?,age_limit;
Do you have an age requirement when opening an account with your service?,age_limit;
Is it possible for me to set up separate accounts for my kids?,age_limit;
I have exceeded the number of PIN attempts,pin_blocked;
I mistook my pin and now I am locked.  Can you unlock me?,pin_blocked;
Please help me unblock my pin which I put the wrong one too many times.,pin_blocked;
Help me unblock my account.  I entered the PIN wrong too many times.,pin_blocked;
I locked myself out of my account\, how do I unblock my PIN?,pin_blocked;
My PIN tries have run out. Now what?,pin_blocked;
Can I reset my PIN if it is blocked?,pin_blocked;
After inputting the wrong pin too many times\, can you now help me unblock my pin?,pin_blocked;
Where do I find PIN for my card?,pin_blocked;
Can someone help me unblock my pin?,pin_blocked;
I attempted to enter my pin to many times.,pin_blocked;
I forgot my PIN and now it is blocked.,pin_blocked;
Can someone assist me with explaining how I can unblock my pin?,pin_blocked;
My pin needs unblocking\, unblock it please?,pin_blocked;
What do I have to do to get my PIN unblocked?,pin_blocked;
I tried my PIN too many times and now my card wont work!,pin_blocked;
I entered a wrong PIN too many times. How can I fix this?,pin_blocked;
How can I unblock my PIN?,pin_blocked;
When I was drunk I got my card stuck in your machine because i mis-typed my PIN. What do I need to do to get it restored?,pin_blocked;
I cannot try my PIN anymore.,pin_blocked;
Whats the web address to unblock my pin?,pin_blocked;
How do I make my PIN work again?,pin_blocked;
What steps do I take to unblock my PIN?,pin_blocked;
My PIN was entered wrong and now I am blocked.  Please unblock.,pin_blocked;
Can I use app to unblock my card?,pin_blocked;
I tried the wrong PIN too many times.,pin_blocked;
Help me unblock my PIN.,pin_blocked;
Can I unblock my PIN in the app?,pin_blocked;
How can I get my PIN unblocked?,pin_blocked;
I forgot my PIN number.,pin_blocked;
I tried entering my pin several times incorrectly. Why isnt my pin working?,pin_blocked;
I need my PIN unlocked.,pin_blocked;
I cant input my pin again.,pin_blocked;
How do I take a block off my card?,pin_blocked;
